{
  "schema_version": "2026-04-21",
  "generated_at": "2026-04-22T14:33:21+00:00",
  "stage": "extraction",
  "phase": 0,
  "task": "CommonsenseQA",
  "model": "Qwen/Qwen2.5-1.5B-Instruct",
  "method": "LoRA",
  "scope": "pilot_only",
  "summary": {
    "description": "Registered update-vector extraction for ASCENT-G.",
    "object_type": "registered_concat_lora_A_B"
  },
  "config": {
    "registered_targets": [
      "down_proj",
      "gate_proj",
      "k_proj",
      "o_proj",
      "q_proj",
      "up_proj",
      "v_proj"
    ]
  },
  "metrics": {
    "vector_norm": 22.914953231811523,
    "vector_numel": 9232384
  },
  "artifacts": {
    "vector_path": "/kaggle/working/2026-04-22-phase0-commonsenseqa-qwen2.5-1.5b/update_vector.npy",
    "provenance_path": "/kaggle/working/2026-04-22-phase0-commonsenseqa-qwen2.5-1.5b/update_vector_provenance.json"
  },
  "runtime": {
    "device_dtype": "bfloat16"
  },
  "validation": {
    "registered_targets_all_covered": true,
    "vector_non_degenerate": true,
    "checksum_sha256": "172ebc3af7f0af4881ff9089f01946627649c3d1b4eb64af180257b18e9ff708"
  },
  "notes": [
    "This report tracks the preregistered concat(Delta W_A, Delta W_B) object."
  ]
}
