{
  "schema_version": "2026-04-21",
  "generated_at": "2026-04-22T07:08:36+00:00",
  "stage": "training",
  "phase": 0,
  "task": "GSM8K",
  "model": "Qwen/Qwen2.5-1.5B-Instruct",
  "method": "GRPO",
  "scope": "pilot_only",
  "summary": {
    "description": "Phase 0 Kaggle pilot training completed successfully for GSM8K on Qwen2.5-1.5B-Instruct.",
    "status": "completed",
    "source": "Kaggle notebook output imported into repository run record."
  },
  "config": {
    "max_steps": 50,
    "precision": "bf16",
    "accelerator": "Tesla T4",
    "torch_version": "2.10.0+cu128"
  },
  "metrics": {
    "total_time_sec": 2907.9,
    "per_step_time_sec": 58.16
  },
  "artifacts": {
    "adapter_path": "/tmp/kaggle-kernel-output/gsm8k-qwen2.5-1.5b-phase0/adapter",
    "checkpoint_path": "/tmp/kaggle-kernel-output/gsm8k-qwen2.5-1.5b-phase0/checkpoint-50",
    "source_report_path": "/tmp/kaggle-kernel-output/gsm8k-qwen2.5-1.5b-phase0/run_report.json"
  },
  "runtime": {
    "environment": "Kaggle notebook",
    "gpu_model": "Tesla T4",
    "vram_gb": 15.6,
    "bf16_supported": true
  },
  "validation": {
    "model_loaded": true,
    "training_completed": true,
    "adapter_saved_and_reloaded": true
  },
  "notes": [
    "Run timestamp from Kaggle artifact: 2026-04-21T15:47:24.149191Z.",
    "This is a Phase 0 pipeline-validation run and is not registered evidence for H1a/H1b/H2."
  ]
}
